[
  {
    "year": 1841,
    "dwelling number": 52,
    "census place": "Lockington",
    "place": null,
    "surname": "Allen",
    "forename": "Mary",
    "relation to head": "",
    "condition": "",
    "age": "70",
    "occupation": "lacemaker",
    "born": "Bucks"
  },
  {
    "year": 1841,
    "dwelling number": 52,
    "census place": "Lockington",
    "place": null,
    "surname": "Allen",
    "forename": "Rebecca",
    "relation to head": "",
    "condition": "",
    "age": "30",
    "occupation": "",
    "born": "Bucks"
  },
  {
    "year": 1841,
    "dwelling number": 52,
    "census place": "Lockington",
    "place": null,
    "surname": "Allen",
    "forename": "Joseph",
    "relation to head": "",
    "condition": "",
    "age": "25",
    "occupation": "ag lab",
    "born": "Bucks"
  },
  {
    "year": 1841,
    "dwelling number": 52,
    "census place": "Lockington",
    "place": null,
    "surname": "Allen",
    "forename": "James",
    "relation to head": "",
    "condition": "",
    "age": "2",
    "occupation": "",
    "born": "Bucks"
  },
  {
    "year": 1841,
    "dwelling number": 53,
    "census place": "Lockington",
    "place": null,
    "surname": "Allen",
    "forename": "Thomas",
    "relation to head": "",
    "condition": "",
    "age": "35",
    "occupation": "ag lab",
    "born": "Bucks"
  },
  {
    "year": 1841,
    "dwelling number": 53,
    "census place": "Lockington",
    "place": null,
    "surname": "Allen",
    "forename": "Mary",
    "relation to head": "",
    "condition": "",
    "age": "30",
    "occupation": "lacemaker",
    "born": "Bucks"
  },
  {
    "year": 1841,
    "dwelling number": 53,
    "census place": "Lockington",
    "place": null,
    "surname": "Allen",
    "forename": "Elizabeth",
    "relation to head": "",
    "condition": "",
    "age": "10",
    "occupation": "",
    "born": "Bucks"
  },
  {
    "year": 1841,
    "dwelling number": 53,
    "census place": "Lockington",
    "place": null,
    "surname": "Allen",
    "forename": "Maria",
    "relation to head": "",
    "condition": "",
    "age": "8",
    "occupation": "",
    "born": "Bucks"
  },
  {
    "year": 1841,
    "dwelling number": 53,
    "census place": "Lockington",
    "place": null,
    "surname": "Allen",
    "forename": "Ann",
    "relation to head": "",
    "condition": "",
    "age": "6",
    "occupation": "",
    "born": "Bucks"
  },
  {
    "year": 1841,
    "dwelling number": 53,
    "census place": "Lockington",
    "place": null,
    "surname": "Allen",
    "forename": "Mary",
    "relation to head": "",
    "condition": "",
    "age": "3",
    "occupation": "",
    "born": "Bucks"
  },
  {
    "year": 1841,
    "dwelling number": 53,
    "census place": "Lockington",
    "place": null,
    "surname": "Allen",
    "forename": "William",
    "relation to head": "",
    "condition": "",
    "age": "6/12",
    "occupation": "",
    "born": "Bucks"
  },
  {
    "year": 1841,
    "dwelling number": 54,
    "census place": "Lockington",
    "place": null,
    "surname": "Roberts",
    "forename": "William",
    "relation to head": "",
    "condition": "",
    "age": "50",
    "occupation": "ag lab",
    "born": "Bucks"
  },
  {
    "year": 1841,
    "dwelling number": 54,
    "census place": "Lockington",
    "place": null,
    "surname": "Roberts",
    "forename": "Mary",
    "relation to head": "",
    "condition": "",
    "age": "55",
    "occupation": "",
    "born": "Bucks"
  },
  {
    "year": 1841,
    "dwelling number": 54,
    "census place": "Lockington",
    "place": null,
    "surname": "Gregory",
    "forename": "Dominick",
    "relation to head": "",
    "condition": "",
    "age": "84",
    "occupation": "ag lab",
    "born": "Bucks"
  },
  {
    "year": 1841,
    "dwelling number": 55,
    "census place": "Lockington",
    "place": null,
    "surname": "Burnham",
    "forename": "Joseph",
    "relation to head": "",
    "condition": "",
    "age": "30",
    "occupation": "ag lab",
    "born": "Bucks"
  },
  {
    "year": 1841,
    "dwelling number": 55,
    "census place": "Lockington",
    "place": null,
    "surname": "Burnham",
    "forename": "Lydia",
    "relation to head": "",
    "condition": "",
    "age": "20",
    "occupation": "lacemaker",
    "born": "Bucks"
  },
  {
    "year": 1841,
    "dwelling number": 55,
    "census place": "Lockington",
    "place": null,
    "surname": "Burnham",
    "forename": "Emma",
    "relation to head": "",
    "condition": "",
    "age": "2",
    "occupation": "",
    "born": "Bucks"
  },
  {
    "year": 1841,
    "dwelling number": 56,
    "census place": "Lockington",
    "place": null,
    "surname": "Watson",
    "forename": "Thomas",
    "relation to head": "",
    "condition": "",
    "age": "40",
    "occupation": "ag lab",
    "born": "Bucks"
  },
  {
    "year": 1841,
    "dwelling number": 56,
    "census place": "Lockington",
    "place": null,
    "surname": "Watson",
    "forename": "Mary",
    "relation to head": "",
    "condition": "",
    "age": "30",
    "occupation": "lacemaker",
    "born": "Bucks"
  },
  {
    "year": 1841,
    "dwelling number": 56,
    "census place": "Lockington",
    "place": null,
    "surname": "Watson",
    "forename": "Fanny",
    "relation to head": "",
    "condition": "",
    "age": "8",
    "occupation": "",
    "born": "Bucks"
  },
  {
    "year": 1841,
    "dwelling number": 56,
    "census place": "Lockington",
    "place": null,
    "surname": "Watson",
    "forename": "Harriet",
    "relation to head": "",
    "condition": "",
    "age": "6",
    "occupation": "",
    "born": "Bucks"
  },
  {
    "year": 1841,
    "dwelling number": 56,
    "census place": "Lockington",
    "place": null,
    "surname": "Watson",
    "forename": "Thomas",
    "relation to head": "",
    "condition": "",
    "age": "1",
    "occupation": "steward",
    "born": "No"
  },
  {
    "year": 1851,
    "dwelling number": 1,
    "census place": "Lockington",
    "place": null,
    "surname": "Allen",
    "forename": "Thomas",
    "relation to head": "head",
    "condition": "wid",
    "age": "42",
    "occupation": "ag lab",
    "born": "Saunderton"
  },
  {
    "year": 1851,
    "dwelling number": 1,
    "census place": "Lockington",
    "place": null,
    "surname": "Allen",
    "forename": "Ann",
    "relation to head": "dau",
    "condition": "unm",
    "age": "15",
    "occupation": "lacemaker",
    "born": "Saunderton"
  },
  {
    "year": 1851,
    "dwelling number": 1,
    "census place": "Lockington",
    "place": null,
    "surname": "Allen",
    "forename": "Mary",
    "relation to head": "dau",
    "condition": "unm",
    "age": "13",
    "occupation": "lacemaker",
    "born": "Saunderton"
  },
  {
    "year": 1851,
    "dwelling number": 1,
    "census place": "Lockington",
    "place": null,
    "surname": "Allen",
    "forename": "William",
    "relation to head": "son",
    "condition": "unm",
    "age": "10",
    "occupation": "",
    "born": "Saunderton"
  },
  {
    "year": 1851,
    "dwelling number": 1,
    "census place": "Lockington",
    "place": null,
    "surname": "Allen",
    "forename": "Lucy",
    "relation to head": "dau",
    "condition": "unm",
    "age": "8",
    "occupation": "lacemaker",
    "born": "Saunderton"
  },
  {
    "year": 1851,
    "dwelling number": 1,
    "census place": "Lockington",
    "place": null,
    "surname": "Allen",
    "forename": "Jane",
    "relation to head": "dau",
    "condition": "unm",
    "age": "6",
    "occupation": "",
    "born": "Saunderton"
  },
  {
    "year": 1851,
    "dwelling number": 2,
    "census place": "Lockington",
    "place": null,
    "surname": "Burnham",
    "forename": "Joseph",
    "relation to head": "head",
    "condition": "mar",
    "age": "40",
    "occupation": "ag lab",
    "born": "Bucks Kings"
  },
  {
    "year": 1851,
    "dwelling number": 2,
    "census place": "Lockington",
    "place": null,
    "surname": "Burnham",
    "forename": "Lydia",
    "relation to head": "wife",
    "condition": "mar",
    "age": "30",
    "occupation": "lacemaker",
    "born": "Saunderton"
  },
  {
    "year": 1851,
    "dwelling number": 2,
    "census place": "Lockington",
    "place": null,
    "surname": "Burnham",
    "forename": "James",
    "relation to head": "son",
    "condition": "unm",
    "age": "5",
    "occupation": "scholar",
    "born": "Saunderton"
  },
  {
    "year": 1851,
    "dwelling number": 2,
    "census place": "Lockington",
    "place": null,
    "surname": "Burnham",
    "forename": "Charlotte",
    "relation to head": "dau",
    "condition": "unm",
    "age": "2",
    "occupation": "",
    "born": "Saunderton"
  },
  {
    "year": 1851,
    "dwelling number": 3,
    "census place": "Lockington",
    "place": null,
    "surname": "Bass",
    "forename": "Joseph",
    "relation to head": "head",
    "condition": "mar",
    "age": "32",
    "occupation": "ag lab",
    "born": "Princes Risborough"
  },
  {
    "year": 1851,
    "dwelling number": 3,
    "census place": "Lockington",
    "place": null,
    "surname": "Bass",
    "forename": "Drusilla",
    "relation to head": "wife",
    "condition": "mar",
    "age": "32",
    "occupation": "lacemaker",
    "born": "Princes Risborough"
  },
  {
    "year": 1851,
    "dwelling number": 3,
    "census place": "Lockington",
    "place": null,
    "surname": "Bass",
    "forename": "Maria",
    "relation to head": "dau",
    "condition": "unm",
    "age": "13",
    "occupation": "lacemaker",
    "born": "Princes Risborough"
  },
  {
    "year": 1851,
    "dwelling number": 3,
    "census place": "Lockington",
    "place": null,
    "surname": "Bass",
    "forename": "Emma",
    "relation to head": "dau",
    "condition": "unm",
    "age": "10",
    "occupation": "lacemaker",
    "born": "Princes Risborough"
  },
  {
    "year": 1851,
    "dwelling number": 3,
    "census place": "Lockington",
    "place": null,